{
  "schema_version": "pgworkbench.critical-finding-review/v1",
  "artifact_type": "pgworkbench.critical-finding-review",
  "record_status": "signed",
  "review_id": "invalid-critical-review",
  "candidate": {
    "version": "0.2.0",
    "tag": "v0.2.0",
    "git_commit": "1111111111111111111111111111111111111111",
    "pack_digest": "sha256:1111111111111111111111111111111111111111111111111111111111111111"
  },
  "scope": ["security", "data-loss", "portability", "evidence-integrity"],
  "repository_controls": {
    "tag_ruleset": {
      "status": "verified",
      "id": 1,
      "updated_at": "2026-08-13T00:00:00Z",
      "target": "tag",
      "enforcement": "active",
      "include_pattern": "refs/tags/v*",
      "excludes": [],
      "creation_restricted": true,
      "update_prohibited": true,
      "deletion_prohibited": true,
      "bypass_actors_reviewed": true,
      "evidence": {
        "ref": "urn:pgworkbench:evidence:tag-ruleset",
        "digest": "sha256:2222222222222222222222222222222222222222222222222222222222222222",
        "captured_at": "2026-08-13T00:00:00Z"
      }
    },
    "immutable_releases": {
      "status": "verified",
      "enabled": true,
      "enforced_by_owner": false,
      "evidence": {
        "ref": "urn:pgworkbench:evidence:immutable-releases",
        "digest": "sha256:3333333333333333333333333333333333333333333333333333333333333333",
        "captured_at": "2026-08-13T00:00:00Z"
      }
    }
  },
  "findings": [
    {
      "id": "SEC-1",
      "category": "security",
      "severity": "critical",
      "status": "open",
      "summary": "Invalid fixture: unresolved critical finding."
    }
  ],
  "decision": {
    "status": "go",
    "recorded_at": "2026-08-13T00:00:00Z",
    "rationale": "Invalid fixture: GO must reject this open critical finding."
  },
  "signoff": {
    "status": "signed",
    "reviewer": "repository-admin",
    "reviewer_role": "repository-administrator",
    "signed_at": "2026-08-13T00:00:00Z",
    "statement": "Invalid fixture signoff.",
    "signature_evidence": {
      "ref": "urn:pgworkbench:evidence:admin-signature",
      "digest": "sha256:4444444444444444444444444444444444444444444444444444444444444444",
      "captured_at": "2026-08-13T00:00:00Z"
    }
  }
}
